indicator_label,indicator_name,indicator_category,indicator_target,indicator_GAP_category,evaluator_name,evaluator_flag,evaluator_comments,connection_human_health,connection_animal_health,connection_plant_health,connection_environmnental_health,AT1_health_systems_usability,AT1_health_systems_action,AT2_pandemic_zoonoses_usability,AT2_pandemic_zoonoses_action,AT3_endemic_zoonoses_usability,AT3_endemic_zoonoses_action,AT4_food_safety_usability,AT4_food_safety_action,AT5_antimicrobial_resistance_usability,AT5_antimicrobial_resistance_action,AT6_environment_usability,AT6_environment_action
8.CT.1,Number of countries that adopt and implement national disaster risk reduction strategies in line with the Sendai Framework for Disaster Risk Reduction 2015–2030,component,target 8,Climate change,Elodie Eiffener,,"Indicator = positive for H. Indicator of disease and deterioration prevention. Disaster in turn causes disease and deterioration, indirect effects with 2+ steps",potentially connected,potentially connected,potentially connected,potentially connected,directly usable,action 1.1,directly usable,action 2.3,directly usable,action 3.3,not usable,none,usable after adaptation,action 5.1,usable after adaptation,action 6.1
8.CT.2,Bioclimatic Ecosystem Resilience Index (BERI),component,target 8,Climate change,Gabriel Munoz Acevedo,,Can indicate which natural habitat configurations are more resilient to climate change / underlying mechanisms of index calculation may be confounding or correlated with other indicators,potentially connected,indirectly connected,indirectly connected,directly connected,not usable,none,not usable,none,not usable,none,usable after adaptation,action 4.2,not usable,none,directly usable,action 6.2
8.CY.1,Above-ground biomass stock in forest (tons/ha),complementary,target 8,Climate change,Gabriel Munoz Acevedo,,"Relative change in aboveground biomass may serve as indicator of aspects affecting health such as burning and/or deforestation. Globally confounded, needs to be assesed relative to itself",directly connected,directly connected,indirectly connected,directly connected,not usable,none,not usable,none,not usable,none,not usable,none,not usable,none,directly usable,action 6.2
8.CY.2,"National greenhouse gas inventories from land use, land-use change and forestry",complementary,target 8,Climate change,Gabriel Munoz Acevedo,,"Greenhouse gases are a direct thread to human population, includling respiratory and cardiovascular diseases",directly connected,directly connected,directly connected,directly connected,not usable,none,not usable,none,not usable,none,not usable,none,not usable,none,directly usable,action 6.3
8.CY.3,Proportion of local governments that adopt and implement local disaster risk reduction strategies in line with national disaster risk reduction strategies,complementary,target 8,Climate change,Gabriel Munoz Acevedo,,Disaster risk prevention is directly managed from local goverments. ,directly connected,potentially connected,potentially connected,potentially connected,directly usable,action 1.3,usable after adaptation,action 2.2,not usable,none,usable after adaptation,action 4.2,not usable,none,not usable,none
8.CY.4,Average marine acidity (pH) measured at agreed suite of representative sampling stations,complementary,target 8,Climate change,Gabriel Munoz Acevedo,,Marine acidity influences food security and nutritional value of seafood.,directly connected,directly connected,indirectly connected,indirectly connected,not usable,none,usable after adaptation,action 2.2,not usable,none,not usable,none,not usable,none,directly usable,action 6.3
9.1,Benefits from the sustainable use of wild species,headline,target 9,Species management,Elodie Eiffener,🚩,Indicator = positive for H. Not sure what is meant with sustainable use of wild species or what are examples of such benefits.,potentially connected,indirectly connected,potentially connected,indirectly connected,directly usable,action 1.1,usable after adaptation,action 2.1,directly usable,action 3.3,not usable,none,not usable,none,directly usable,action 6.1
9.2,Percentage of the population in traditional occupations,headline,target 9,Species management,Gabriel Munoz Acevedo,🚩,"People with traditional occupations can influence positively health of rural and indigenous communities. the links for the health in urban populations maybe lower. More people in traditional occupations create a greater 'connection' with nature in their societies. Potentially, emphasizing traditional practices that maintain health in the absence of primary care",indirectly connected,indirectly connected,indirectly connected,indirectly connected,directly usable,action 1.2,not usable,none,not usable,,directly usable,action 4.2,not usable,none,not usable,none
9.b,"Number or countries with policies to manage the use of wild species sustainably, providing social, economic and environmental benefits for people, and to protect and encourage customary sustainable use by indigenous peoples and local communities",binary,target 9,Species management,Elodie Eiffener,,Indicator = positive for H. Regulation building the basis for sustainability. ,indirectly connected,indirectly connected,indirectly connected,indirectly connected,directly usable,action 1.1,directly usable,action 2.3,directly usable,action 3.3,not usable,none,not usable,none,directly usable,action 6.1
9.CT.1,Red List Index (species used for food and medicine),component,target 9,Species management,Andrea Paz Velez,,Would need to be adapted to know if use is for food and/or medicine and if plant/animal,potentially connected,potentially connected,potentially connected,not connected,not usable,none,not usable,none,not usable,none,usable after adaptation,action 4.2,not usable,none,not usable,none
9.CY.1,Spawning stock biomass (related to commercially exploited species),complementary,target 9,Species management,Francis Banville,,,potentially connected,directly connected,directly connected,directly connected,not usable,none,not usable,none,not usable,none,directly usable,action 4.3,usable after adaptation,action 5.1,directly usable,action 6.1
9.CY.2,Volume of production per labour unit by classes of farming/pastoral/forestry enterprise size,complementary,target 9,Species management,Francis Banville,,,indirectly connected,directly connected,directly connected,directly connected,not usable,none,usable after adaptation,action 2.3,usable after adaptation,action 3.1,directly usable,action 4.3,usable after adaptation,action 5.1,directly usable,action 6.1
9.CY.3,Red List Index (impact of utilization),complementary,target 9,Species management,Andrea Paz Velez,,,not connected,potentially connected,potentially connected,potentially connected,not usable,none,not usable,none,not usable,none,not usable,none,not usable,none,not usable,none
10.1,Proportion of agricultural area under productive and sustainable agriculture,headline,target 10,"Agriculture, aquaculture, fisheries and forestry",Elodie Eiffener,,"Indicator = positive for H. The higher the % the better for H. Examples: livelihoods of people, thriving plants/crops, animal welfare",directly connected,directly connected,directly connected,directly connected,usable after adaptation,action 1.2,usable after adaptation,action 2.1,not usable,none,directly usable,action 4.1,not usable,none,directly usable,action 6.1
10.2,Progress towards sustainable forest management,headline,target 10,"Agriculture, aquaculture, fisheries and forestry",Gabriel Munoz Acevedo,,Sustainable management of forests can increase nature access and reduce deforestation (with its negative outcomes for health),indirectly connected,indirectly connected,indirectly connected,directly connected,directly usable,action 1.3,usable after adaptation,action 2.2,usable after adaptation,action 3.2,directly usable,action 4.2,not usable,none,directly usable,action 6.1
10.CT.1,"Average income of small-scale food producers, by sex and indigenous status",component,target 10,"Agriculture, aquaculture, fisheries and forestry",Elodie Eiffener,,"Indicator = positive for H. The higher the income, the better for the food producers and better for their livelihood and animals/plants in turn. Indicates resources to take care of H. ",indirectly connected,indirectly connected,indirectly connected,indirectly connected,usable after adaptation,action 1.2,usable after adaptation,action 2.1,usable after adaptation,action 3.3,usable after adaptation,action 4.1,not usable,none,usable after adaptation,action 6.1
10.CY.1,Agrobiodiversity Index,complementary,target 10,"Agriculture, aquaculture, fisheries and forestry",Gabriel Munoz Acevedo,,,directly connected,potentially connected,indirectly connected,indirectly connected,directly usable,action 1.3,not usable,none,not usable,none,directly usable,action 4.2,not usable,none,not usable,none
10.CY.2,Soil organic carbon stocks,complementary,target 10,"Agriculture, aquaculture, fisheries and forestry",Gabriel Munoz Acevedo,,Can indicate potential for nutriitious food production,indirectly connected,indirectly connected,directly connected,directly connected,not usable,none,usable after adaptation,action 2.2,not usable,none,usable after adaptation,action 4.2,not usable,none,directly usable,action 6.3
10.CY.3,Red List Index (forest specialist species),complementary,target 10,"Agriculture, aquaculture, fisheries and forestry",Gabriel Munoz Acevedo,,Can indicate health status of forest ecosystems,potentially connected,directly connected,directly connected,directly connected,not usable,none,usable after adaptation,action 2.2,not usable,none,usable after adaptation,action 4.2,not usable,none,usable after adaptation,action 6.4
10.CY.4,Area of forest under sustainable management: total forest management certification by the Forest Stewardship Council and the Programme for the Endorsement of Forest Certification,complementary,target 10,"Agriculture, aquaculture, fisheries and forestry",Gabriel Munoz Acevedo,,"Connection to human health at large scale due to carbon sinks, recreation (if accessible). Sustainable practices may be focused in sustain forestry products rather than ecosystem structure per se. ",indirectly connected,indirectly connected,directly connected,directly connected,not usable,none,not usable,none,usable after adaptation,action 3.2,usable after adaptation,action 4.2,not usable,none,directly usable,action 6.3
11.CT.1,Annual mean levels of fine particulate matter (e.g. PM2.5 and PM10) in cities,component,target 11,Nature’s contributions to people,Elodie Eiffener,,"Indicator = negative for H. The higher the concentration the worse. Examples: respiratory illnesses like asthma and COPD, heart diseases, lung cancer allergies, perceived wellbeing. Impacts of air pollution on animals less explored but there are findings, including endocrine disruptions, increased vet visits and similar health effects to humans. Impacts on plants are also explored, including damages on leaves, roots, growth and flowering",directly connected,directly connected,directly connected,directly connected,usable after adaptation,action 1.2,not usable,none,not usable,none,not usable,none,not usable,none,directly usable,action 6.1
11.CT.2,Proportion of bodies of water with good ambient water quality,component,target 11,Nature’s contributions to people,Gabriel Munoz Acevedo,,wastewater discharge has negative impacts on health of living beings,directly connected,directly connected,directly connected,directly connected,directly usable,action 1.1,directly usable,action 2.1,not usable,none,directly usable,action 4.1,not usable,none,directly usable,action 6.1
11.CT.3,Level of water stress: freshwater withdrawal as a proportion of available freshwater resources,component,target 11,Nature’s contributions to people,Francis Banville,,,directly connected,directly connected,directly connected,directly connected,not usable,none,directly usable,action 2.1,usable after adaptation,action 3.2,directly usable,action 4.1,not usable,none,directly usable,action 6.1
11.CY.1,Air emission accounts,complementary,target 11,Nature’s contributions to people,Gabriel Munoz Acevedo,,"Air emissions have negative impacts locally to the populations and ecosystems, but also globaly by promoting climate change and climate instability",directly connected,directly connected,directly connected,directly connected,directly usable,action 1.1,not usable,none,not usable,none,not usable,none,not usable,none,directly usable,action 6.1
11.CY.2,Proportion of local administrative units with established and operational policies and procedures for participation of local communities in water and sanitation management,complementary,target 11,Nature’s contributions to people,Gabriel Munoz Acevedo,,"Skate holder participation measures indicate the long term sustainability of water quality policies. ensuring positive health outcomes to the future. hypothesis: those palces with greater engagement do have healthier human, animal, plant, populations? ",indirectly connected,indirectly connected,indirectly connected,potentially connected,directly usable,action 1.1,not usable,none,not usable,none,directly usable,action 4.2,not usable,none,directly usable,action 6.3
11.CY.3,Proportion of population using safely managed drinking water services,complementary,target 11,Nature’s contributions to people,Gabriel Munoz Acevedo,,"this indicator evaluates access to safe water, which is key for human populations. less so for animals and plants",directly connected,potentially connected,potentially connected,potentially connected,directly usable,action 1.1,not usable,none,not usable,none,directly usable,action 4.1,not usable,none,directly usable,action 6.3
11.CY.4,"Mortality rate attributed to unsafe water, unsafe sanitation and lack of hygiene (exposure to unsafe Water, Sanitation and Hygiene for All (WASH) services)",complementary,target 11,Nature’s contributions to people,Gabriel Munoz Acevedo,,similar rationale as for 11.CY.4,directly connected,potentially connected,potentially connected,potentially connected,directly usable,action 1.1,directly usable,action 2.1,not usable,none,directly usable,action 4.2,not usable,none,directly usable,action 6.3
11.CY.5,"Number of deaths, missing persons and directly affected persons attributed to disasters per 100,000 population",complementary,target 11,Nature’s contributions to people,Gabriel Munoz Acevedo,,"natural disasters are part of ecological processes. unless disasters are increased in frequency due to anthropogenic causes, i feel has no impact on animal-plant-ecosystem as they evolved with them",directly connected,not connected,not connected,not connected,not usable,none,not usable,none,not usable,none,not usable,none,not usable,none,not usable,none
12.1,Average share of the built-up area of cities that is green or blue space for public use for all,headline,target 12,Urban areas,Elodie Eiffener,,"Indicator = positive for H. More green/blue space is better for mental health, recreation, creates habitat, reduces urban heat island effects, increases physical activity, ...",directly connected,directly connected,directly connected,directly connected,usable after adaptation,action 1.2,usable after adaptation,action 2.1,usable after adaptation,action 3.1,usable after adaptation,action 4.1,not usable,none,usable after adaptation,action 6.1
12.b,Number of countries with biodiversity-inclusive urban planning referring to green or blue urban spaces,binary,target 12,Urban areas,Elodie Eiffener,,Indicator = positive for H. Biodiversity-inclusive urban planning means increased biodiversity which in turn influences H. Influences H through 2+ pathways: number - urban planning - biodiversity - H,potentially connected,potentially connected,potentially connected,potentially connected,directly usable,action 1.1,usable after adaptation,action 2.1,usable after adaptation,action 3.1,not usable,none,not usable,none,usable after adaptation,action 6.1
12.CT.1,Singapore Index on Cities’ Biodiversity,component,target 12,Urban areas,Elodie Eiffener,,Indicator = positive for H. Self-assessment tool (subjective). Good index means more biodiversity means better H,indirectly connected,indirectly connected,indirectly connected,indirectly connected,usable after adaptation,action 1.2,usable after adaptation,action 2.1,not usable,none,not usable,none,not usable,none,directly usable,action 6.1
13.b,"Number of countries that have taken effective legal, policy, administrative and capacity-building measures at all levels, as appropriate, to ensure the fair and equitable sharing of benefits from the utilization of genetic resources and from digital sequence information on genetic resources, as well as traditional knowledge associated with genetic resources",binary,target 13,Access and benefit-sharing,Francis Banville,,,directly connected,not connected,not connected,not connected,not usable,none,directly usable,action 2.3,directly usable,action 3.2,directly usable,action 4.3,directly usable,action 5.1,not usable,none
13.CT.1,Total number of internationally recognized certificates published on the Access and Benefit-sharing Clearing-House,component,target 13,Access and benefit-sharing,Francis Banville,,,directly connected,not connected,not connected,not connected,not usable,none,directly usable,action 2.3,directly usable,action 3.2,directly usable,action 4.3,directly usable,action 5.1,not usable,none
13.CY.1,Total number of transfers of crop material from the Multilateral System of the International Treaty on Plant Genetic Resources for Food and Agriculture received in a country,complementary,target 13,Access and benefit-sharing,Francis Banville,,,directly connected,not connected,not connected,not connected,not usable,none,not usable,none,not usable,none,directly usable,action 4.2,not usable,none,not usable,none
14.b,"Number of countries integrating biodiversity and its multiple values into policies, regulations, planning, development processes, poverty eradication strategies and, as appropriate, national accounts, within and across all levels and across all sectors, and progressively aligning all relevant public and private activities and fiscal and financial flows with the goals and targets of the Framework",binary,target 14,Mainstreaming,Francis Banville,,,indirectly connected,potentially connected,potentially connected,indirectly connected,usable after adaptation,action 1.1,usable after adaptation,action 2.3,usable after adaptation,action 3.2,usable after adaptation,action 4.2,usable after adaptation,action 5.3,directly usable,action 6.2
14.CT.1,"Integration of biodiversity into national accounting and reporting systems, defined as implementation of the System of Environmental-Economic Accounting",component,target 14,Mainstreaming,Francis Banville,🚩,,potentially connected,potentially connected,potentially connected,indirectly connected,not usable,none,not usable,none,not usable,none,usable after adaptation,action 4.1,not usable,none,directly usable,action 6.2
15.1,"Number of companies disclosing their biodiversity-related risks, dependencies and impacts",headline,target 15,Mainstreaming,Francis Banville,,,not connected,not connected,not connected,potentially connected,not usable,none,usable after adaptation,action 2.3,usable after adaptation,action 3.2,usable after adaptation,action 4.2,usable after adaptation,action 5.1,directly usable,action 6.1
15.b,"Number of countries with legal, administrative or policy measures aimed at encouraging and enabling business and financial institutions, and in particular for large and transnational companies and financial institutions, to progressively reduce their negative impacts on biodiversity, increase their positive impacts, reduce their biodiversity-related risks and promote actions to ensure sustainable patterns of production",binary,target 15,Mainstreaming,Francis Banville,,,potentially connected,potentially connected,potentially connected,directly connected,not usable,none,usable after adaptation,action 2.3,usable after adaptation,action 3.2,usable after adaptation,action 4.2,usable after adaptation,action 5.1,directly usable,action 6.1
15.CT.1,Number of companies publishing sustainability reports,component,target 15,Mainstreaming,Francis Banville,,,potentially connected,potentially connected,potentially connected,potentially connected,not usable,none,not usable,none,not usable,none,not usable,none,not usable,none,directly usable,action 6.1
15.CY.1,Number of organizations within the country that have signalled an intent to start adopting the recommendations of the Taskforce on Nature-related Financial Disclosures,complementary,target 15,Mainstreaming,Francis Banville,,,potentially connected,potentially connected,potentially connected,potentially connected,not usable,none,not usable,none,not usable,none,not usable,none,not usable,none,directly usable,action 6.2
16.b,"Number of countries developing, adopting or implementing policy instruments aimed at encouraging and enabling people to make sustainable consumption choices",binary,target 16,Consumption,Elodie Eiffener,,Indicator = positive for H. Sustainable consumption in general a healthier choice (e.g. raw and local products) and also better for the environment.   Influences H through 2+ pathways: number - policy instruments - sustainable consumption - H,potentially connected,potentially connected,potentially connected,potentially connected,directly usable,action 1.1,not usable,none,not usable,none,usable after adaptation,action 4.2,not usable,none,directly usable,action 6.1
16.CT.1,Food waste index,component,target 16,Consumption,Elodie Eiffener,,"Indicator = positive for H. Good index means less food waste means better H. Examples: food security, less food-borne illnesses, better air quality (landfills emit methane and VOC), reducing wildlife exposure (and spread of zoonoses), climate impact, soil and water quality. ",indirectly connected,indirectly connected,indirectly connected,indirectly connected,usable after adaptation,action 1.2,usable after adaptation,action 2.1,not usable,none,directly usable,action 4.1,not usable,none,directly usable,action 6.1
16.CT.2,"Material footprint, material footprint per capita, and material footprint per GDP",component,target 16,Consumption,Elodie Eiffener,,Indicator = negative for H. The higher the footpring the worse for H. Material footprint means in general more waste and pollution that in turn affect H and the ecosystems,indirectly connected,indirectly connected,indirectly connected,indirectly connected,usable after adaptation,action 1.2,not usable,none,not usable,none,not usable,none,not usable,none,directly usable,action 6.1
16.CT.3,Ecological footprint,component,target 16,Consumption,Elodie Eiffener,,"Indicator = negative for H. The higher the footprint the worse for H. Connects to material footprint. Examples: climate change, pollution, unsustainable land use and farming. Human health mostly indirectly affected through for instance the examples mentioned. ",indirectly connected,directly connected,directly connected,directly connected,usable after adaptation,action 1.2,not usable,none,not usable,none,not usable,none,not usable,none,directly usable,action 6.1
16.CY.1,Extent to which (i) global citizenship education and (ii) education for sustainable development are mainstreamed in (a) national education policies; (b) curricula; (c) teacher education and (d) student assessment,complementary,target 16,Consumption,Elodie Eiffener,,Indicator = positive for H. Education and knowledge are crucial in sustainable development and One Health. Important indicator but influences H through 2+ pathways: Education extent - education - knowledge - behaviour - H,potentially connected,potentially connected,potentially connected,potentially connected,directly usable,action 1.1,usable after adaptation,action 2.3,usable after adaptation,action 3.1,directly usable,action 4.2,not usable,none,directly usable,action 6.4
16.CY.2,"National recycling rate, tons of material recycled",complementary,target 16,Consumption,Elodie Eiffener,,Indicator = positive for H. More recycling means less pollution which has less impact on H and environment,indirectly connected,indirectly connected,indirectly connected,indirectly connected,usable after adaptation,action 1.2,usable after adaptation,action 2.1,not usable,none,usable after adaptation,action 4.1,not usable,none,directly usable,action 6.1
16.CY.3,Human Appropriation of Net Primary Production,complementary,target 16,Consumption,Francis Banville,,,indirectly connected,potentially connected,potentially connected,directly connected,not usable,none,not usable,none,not usable,none,not usable,none,not usable,none,usable after adaptation,action 6.1
16.CY.4,CO2 emission per unit of value added,complementary,target 16,Consumption,Francis Banville,,,indirectly connected,indirectly connected,indirectly connected,indirectly connected,not usable,none,not usable,none,not usable,none,not usable,none,not usable,none,directly usable,action 6.1
16.CY.5,Change in water-use efficiency over time,complementary,target 16,Consumption,Francis Banville,,,directly connected,indirectly connected,indirectly connected,directly connected,not usable,none,not usable,none,not usable,none,directly usable,action 4.1,usable after adaptation,action 5.1,directly usable,action 6.1
16.CY.6,Indicators from the Life Cycle Impact Assessment Programme,complementary,target 16,Consumption,Francis Banville,,,potentially connected,not connected,not connected,potentially connected,not usable,none,not usable,none,not usable,none,directly usable,action 4.2,not usable,none,directly usable,action 6.1
