indicator_label,indicator_name,indicator_category,indicator_target,indicator_GAP_category,evaluator_name,evaluator_flag,evaluator_comments,connection_human_health,connection_animal_health,connection_plant_health,connection_environmnental_health,AT1_health_systems_usability,AT1_health_systems_action,AT2_pandemic_zoonoses_usability,AT2_pandemic_zoonoses_action,AT3_endemic_zoonoses_usability,AT3_endemic_zoonoses_action,AT4_food_safety_usability,AT4_food_safety_action,AT5_antimicrobial_resistance_usability,AT5_antimicrobial_resistance_action,AT6_environment_usability,AT6_environment_action
1.1,Percentage of land and sea area covered by biodiversity-inclusive spatial plans,headline,target 1,Land and sea use,Gabriel Munoz Acevedo,,"Area alone may not cover key areas for biodiversity monitoring. biodiversity inclusive plans can provision more recreational areas where people increase activity and reduce stress, leading to positive outcomes in mental and physical health. Important to notice that magnitude of effects of increased biodiversity planning for human health may differ btw populations of cities vs rural areas as well as develop and non-developed countries. ",potentially connected,directly connected,directly connected,directly connected,directly usable,action 1.1,directly usable,action 2.3,directly usable,action 3.1,not usable,none,not usable,none,directly usable,action 6.1
1.b,"Number of countries using participatory, integrated and biodiversity-inclusive spatial planning and/or effective management processes addressing land- and sea-use change to bring the loss of areas of high biodiversity importance close to zero by 2030",binary,target 1,Land and sea use,Gabriel Munoz Acevedo,,A higher number of countries can reflect greater engagement with biodiversity conservation overall and a greater political understanding of the connections between biodiversity and human health. ,indirectly connected,directly connected,directly connected,directly connected,usable after adaptation,action 1.3,directly usable,action 2.3,directly usable,action 3.2,not usable,none,not usable,none,directly usable,action 6.3
1.CY.1,Proportion of transboundary basin area with an operational arrangement for water cooperation,complementary,target 1,Land and sea use,Gabriel Munoz Acevedo,,"More cooperation could ensure permanence and quality of water monitoring efforts. Changes in water ecology may be reported earlier, leading to greater water quality and better population health. Simbolizes greater political engagement of populations between political entities across boundaries, higher likelihood of regional water-health related project implementation. ",indirectly connected,indirectly connected,indirectly connected,indirectly connected,not usable,none,directly usable,action 2.3,directly usable,action 3.2,usable after adaptation,action 4.3,not usable,none,directly usable,action 6.3
2.1,Area under restoration,headline,target 2,Land and sea use,Elodie Eiffener,,"Indicator = positive for (future) H. Direct indicator of ecosystem state. Benefits for H at a later stage (after restoration). Examples: better food security, habitat creation for wildlife, plant diversity, resilience",directly connected,directly connected,directly connected,directly connected,usable after adaptation,action 1.2,directly usable,action 2.1,not usable,none,usable after adaptation,action 4.1,not usable,none,directly usable,action 6.1
2.CT.1,Proportion of land that is degraded over total land area,component,target 2,Land and sea use,Gabriel Munoz Acevedo,,"Environmental degradation influences food security, water quality, and disiease emergence. e.g. Leshmania is more prevalent in recently deforested areas compared to native forests in the tropics.  ",directly connected,directly connected,directly connected,directly connected,directly usable,action 1.2,directly usable,action 2.2,directly usable,action 3.2,not usable,none,not usable,none,directly usable,action 6.1
2.CY.1,Global Ecosystem Restoration Index,complementary,target 2,Land and sea use,Gabriel Munoz Acevedo,,Its hard to asses whether ecosystem - pop health relationships are restored after an initial change of state. Legacy effects of environmental degradation may still hunt human communities after the ecosystem is restored.,potentially connected,indirectly connected,indirectly connected,directly connected,directly usable,action 1.2,directly usable,action 2.3,directly usable,action 3.2,not usable,none,not usable,none,directly usable,action 6.3
2.CY.2,Proportion of key biodiversity areas in favourable condition,complementary,target 2,Land and sea use,Gabriel Munoz Acevedo,,"KBAs are mainly defined with ecological criteria towards conserving rare or endemic species and pristine habitats. This geographical regions may not cover the ranges with species influencing human health, or with continous contact with human societies. The extent of its favourable condition may therefore be tangent to human health",potentially connected,indirectly connected,indirectly connected,indirectly connected,usable after adaptation,action 1.1,directly usable,action 2.2,directly usable,action 3.2,not usable,none,not usable,none,directly usable,action 6.3
3.1,Coverage of protected areas and other effective area-based conservation measures,headline,target 3,Land and sea use,Gabriel Munoz Acevedo,,"Area based conservation measures can reduce stress to animal populations. Protected areas tend to be away from human settlements, the links to human health may be contingent on the species inhabiting the protected areas",indirectly connected,directly connected,directly connected,directly connected,directly usable,action 1.2,usable after adaptation,action 2.3,usable after adaptation,action 3.2,not usable,none,not usable,none,directly usable,action 6.1
3.CT.1,Protected Area Connectedness Index,component,target 3,Land and sea use,Gabriel Munoz Acevedo,,"Connectedness among protected areas is key to mantain population health and genetic connectivity, potentially reducing population stress and zoonotic thread emergence",indirectly connected,indirectly connected,indirectly connected,directly connected,directly usable,action 1.3,directly usable,action 2.1,not usable,none,not usable,none,not usable,none,directly usable,action 6.3
3.CT.2,Species Protection Index,component,target 3,Land and sea use,Elodie Eiffener,,"Indicator = positive for H. Measures adequacy of protected areas for species H. Examples: Food security, protection of extinction, habitat, climate resilience",directly connected,directly connected,directly connected,directly connected,usable after adaptation,action 1.2,not usable,none,not usable,none,usable after adaptation,action 4.1,not usable,none,directly usable,action 6.1
3.CY.1,"Rate of protected area downgrading, downsizing and degazettement events",complementary,target 3,Land and sea use,Gabriel Munoz Acevedo,,Downgraded protection of protected area can trigger environmental degradation,potentially connected,indirectly connected,indirectly connected,indirectly connected,not usable,none,directly usable,action 2.1,directly usable,action 3.2,not usable,none,not usable,none,directly usable,action 6.1
3.CY.2,International Union for Conservation of Nature Green List of Protected and Conserved Areas Standard,complementary,target 3,Land and sea use,Gabriel Munoz Acevedo,,"Quality of protected area can help animal-plant populations, but also invite humans to visit the area more often, with the added nature benefits to the population. ",potentially connected,indirectly connected,indirectly connected,indirectly connected,usable after adaptation,action 1.2,not usable,none,usable after adaptation,action 3.2,not usable,none,not usable,none,directly usable,action 6.4
3.CY.3,Protected Area Isolation Index (PAI),complementary,target 3,Land and sea use,Gabriel Munoz Acevedo,,"Better connected protected areas reduce stress in animal populations, thereby reducing zoonotic emergence likelihood",indirectly connected,directly connected,directly connected,directly connected,directly usable,action 1.3,directly usable,action 2.2,directly usable,action 3.2,not usable,none,not usable,none,directly usable,action 6.3
3.CY.4,Protected Areas Network metric,complementary,target 3,Land and sea use,Gabriel Munoz Acevedo,,"Better connected protected areas reduce stress in animal populations, thereby reducing zoonotic emergence likelihood",indirectly connected,directly connected,directly connected,directly connected,directly usable,action 1.3,directly usable,action 2.2,directly usable,action 3.2,not usable,none,not usable,none,directly usable,action 6.3
3.CY.5,Number of protected areas that have completed a site-level assessment of governance and equity,complementary,target 3,Land and sea use,Gabriel Munoz Acevedo,,"Assesment may lead to better management decisions, better conservation outcomes",potentially connected,indirectly connected,indirectly connected,directly connected,not usable,none,usable after adaptation,action 2.3,not usable,none,not usable,none,not usable,none,directly usable,action 6.3
4.CT.1,Number of (a) plant and (b) animal genetic resources for food and agriculture secured in either medium- or long-term conservation facilities,component,target 4,Species management,Gabriel Munoz Acevedo,,Food security in case of global disaster,indirectly connected,not connected,not connected,not connected,not usable,none,not usable,none,not usable,none,directly usable,action 4.1,not usable,none,not usable,none
4.CT.2,Green Status of Species,component,target 4,Species management,Elodie Eiffener,,"Indicator = positive for H. Measuring species recovery rates and impact of coservation efforts. Examples: Food security, protection of extinction, plants as medicine, climate regulation",directly connected,directly connected,directly connected,directly connected,usable after adaptation,action 1.2,not usable,none,not usable,none,directly usable,action 4.1,not usable,none,directly usable,action 6.1
4.CT.3,Human-wildlife conflict indicator,component,target 4,Species management,Gabriel Munoz Acevedo,,"Some wildlife conflicts involve negative outcomes for human populations, albeit much of the time wildlife is the one affected, with indirect effect for humans",potentially connected,directly connected,indirectly connected,indirectly connected,directly usable,action 1.3,directly usable,action 2.2,directly usable,action 3.2,not usable,none,not usable,none,directly usable,action 6.1
4.CT.4,Proportion of local breeds classified as being at risk of extinction,component,target 4,Species management,Elodie Eiffener,,"Indicator = negative for H. The higher the % the worse for H. Examples: Loss of food source or livelihood for humans, ecosystem out of balance, e.g. potential of no natural predators or grazing ",directly connected,directly connected,directly connected,directly connected,usable after adaptation,action 1.2,not usable,none,not usable,none,directly usable,action 4.1,not usable,none,directly usable,action 6.1
4.CY.1,Species threat abatement and restoration metric,complementary,target 4,Species management,Andrea Paz Velez,,It measures the potential of investment in an area. If potential of investment does translate in restoration and species protection then this would be connected to ecosystem health and potentially the others by extension. Lots of ifs ,potentially connected,potentially connected,potentially connected,indirectly connected,not usable,none,not usable,none,not usable,none,not usable,none,not usable,none,usable after adaptation,action 6.1
4.CY.2,Number of island invasive alien species eradications,complementary,target 4,Species management,Andrea Paz Velez,,Hard to tell the impact of this on ecosystem health with a number and not a proportion. Not the same to erradicate 1 in 2 than 1 in 100. But still connected to ecosystem health for sure and by extension the others. It potentially has a negative relation with animal/plant health if some of those used species are in fact becoming island invaders. So maybe species identity would be needed,potentially connected,potentially connected,potentially connected,directly connected,not usable,none,usable after adaptation,action 2.1,usable after adaptation,action 3.1,usable after adaptation,action 4.1,not usable,none,directly usable,action 6.1
5.1,Proportion of fish stocks within biologically sustainable levels,headline,target 5,Species management,Elodie Eiffener,,"Indicator = positive for H. The higher the % the better for H. Examples: food security for humans, marine ecosystem in balance",directly connected,directly connected,directly connected,directly connected,usable after adaptation,action 1.2,not usable,none,not usable,none,directly usable,action 4.1,not usable,none,directly usable,action 6.3
5.b,Number of countries with legal instruments or other policy frameworks for regulating trade in wild species,binary,target 5,Species management,Elodie Eiffener,,"Indicator = positive for H. Basis for trying to keep ecosystem in balance, no guaranteed positive health effects though. Influences H through 2+ pathways: number - legal instrument - wild trade - H",potentially connected,potentially connected,potentially connected,potentially connected,directly usable,action 1.1,directly usable,action 2.1,directly usable,action 3.3,not usable,none,not usable,none,directly usable,action 6.1
5.CT.1,Red List Index (impacts of utilization) for utilized species,component,target 5,Species management,Andrea Paz Velez,,This is interesting but hard to spearate animal and plant health so potentially doing it separately for both would make it usable. But in general disapearance of important species might impact human health ,directly connected,potentially connected,potentially connected,indirectly connected,not usable,none,not usable,none,not usable,none,directly usable,action 4.2,not usable,none,usable after adaptation,action 6.3
5.CT.2,"Degree of implementation of international instruments aiming to combat illegal, unreported and unregulated fishing",component,target 5,Species management,Gabriel Munoz Acevedo,,"The implementation of instruments to prevent illegal, unreported, and unregulated fisheries can impact in human health trough better sanitary conditions for storing and distribution, and better health of consumed wildlife",indirectly connected,indirectly connected,not connected,indirectly connected,not usable,none,directly usable,action 2.2,directly usable,action 3.2,directly usable,action 4.1,not usable,none,directly usable,action 6.3
5.CY.1,Inland fisheries threat indicator,complementary,target 5,Species management,Andrea Paz Velez,,"Connected to food safety directly and potentially ecosystem health as the index includes things like pollution, habitat degradation, cliamte change",potentially connected,directly connected,not connected,potentially connected,not usable,none,not usable,none,not usable,none,directly usable,action 4.2,not usable,none,usable after adaptation,action 6.2
5.CY.2,Red List Index (for internationally traded species),complementary,target 5,Species management,Andrea Paz Velez,,"Potentially usable if subsetting these species into other groupings (traded for food for example, or potential disease secondary hosts). It would be a stretch connecting it to ecosystem health though",potentially connected,potentially connected,potentially connected,potentially connected,not usable,none,usable after adaptation,action 2.2,usable after adaptation,action 3.1,usable after adaptation,action 4.2,not usable,none,not usable,none
5.CY.3,Red List Index (impacts of fisheries),complementary,target 5,Species management,Andrea Paz Velez,,Directly a measure of impacts on ecosystem health,potentially connected,potentially connected,potentially connected,directly connected,not usable,none,not usable,none,not usable,none,not usable,none,not usable,none,directly usable,action 6.1
5.CY.4,Marine Stewardship Council Fish Certified Catch,complementary,target 5,Species management,Andrea Paz Velez,🚩,measure of sustainable fishing could be related to fish health but not directly ,not connected,potentially connected,not connected,potentially connected,not usable,none,not usable,none,not usable,none,not usable,none,not usable,none,not usable,none
5.CY.5,Total catch of cetaceans under the International Convention for the Regulation of Whaling,complementary,target 5,Species management,Andrea Paz Velez,,,not connected,not connected,not connected,potentially connected,not usable,none,not usable,none,not usable,none,not usable,none,not usable,none,not usable,none
5.CY.6,By-catch of vulnerable and non-target species,complementary,target 5,Species management,Andrea Paz Velez,,Because it is related to population trends for these species it can be used potentially for environmental health. Because its by-catch then not usable for used species of fish,not connected,not connected,not connected,potentially connected,not usable,none,not usable,none,not usable,none,not usable,none,not usable,none,directly usable,action 6.1
5.CY.7,Number of Marine Stewardship Council chain of custody certification holders by distribution country,complementary,target 5,Species management,Francis Banville,,,potentially connected,directly connected,not connected,directly connected,not usable,none,not usable,none,not usable,none,directly usable,action 4.1,not usable,none,directly usable,action 6.1
5.CY.8,"Biodiversity-based trade, growth rates",complementary,target 5,Species management,Francis Banville,,,potentially connected,directly connected,directly connected,directly connected,not usable,none,usable after adaptation,action 2.1,usable after adaptation,action 3.1,usable after adaptation,action 4.3,not usable,none,directly usable,action 6.3
6.1,Rate of invasive alien species establishment,headline,target 6,Invasive alien species,Gabriel Munoz Acevedo,,Rate of alien species establishment may indicate resilience of community. Low resilience / high alien establishment may flag communities where zoonotic risk emergence is also high,directly connected,directly connected,directly connected,directly connected,not usable,none,directly usable,action 2.1,not usable,none,usable after adaptation,action 4.2,not usable,none,directly usable,action 6.4
6.b,"Number of countries adopting relevant regulations, processes and measures to reduce the impact of invasive alien species",binary,target 6,Invasive alien species,Elodie Eiffener,🚩,"Indicator = positive for H. Indicator of presence of alien species and through that influence on H.Basis for trying to keep ecosystem in balance, no guaranteed positive health effects though. Invasive alien species covers both animals and plants? Influences H through 2+ pathways: number - regulation - alien species - H",potentially connected,potentially connected,potentially connected,potentially connected,directly usable,action 1.1,not usable,none,not usable,none,usable after adaptation,action 4.1,not usable,none,usable after adaptation,action 6.2
6.CY.1,Red List Index (impacts of invasive alien species),complementary,target 6,Invasive alien species,Gabriel Munoz Acevedo,,Can indicate areas of highly manufactured biodiversity where evolutionary connections and gardrails are severed. higher zoonotic risk emergence ,directly connected,directly connected,directly connected,directly connected,usable after adaptation,action 1.2,directly usable,action 2.1,not usable,none,usable after adaptation,action 4.2,not usable,none,directly usable,action 6.4
7.1,Index of coastal eutrophication,headline,target 7,Pollution,Elodie Eiffener,,"Indicator = negative for H. Eutrophication: excessive enrichment of coastal waters, mainly man-made. Examples:  ""dead zones"" in ocean, harmful algae blooms, marine ecosystem out of balance",indirectly connected,directly connected,directly connected,directly connected,usable after adaptation,action 1.2,not usable,none,not usable,none,directly usable,action 4.1,not usable,none,directly usable,action 6.1
7.2,Pesticide environment concentration and/or aggregated total applied toxicity,headline,target 7,Pollution,Elodie Eiffener,🚩,Indicator = negative for H. Not sure what agggregated total applied toxicity exactly is but i assume it relates to pollution. Direct H effects to all species.,directly connected,directly connected,directly connected,directly connected,usable after adaptation,action 1.2,not usable,none,not usable,none,usable after adaptation,action 4.1,not usable,none,directly usable,action 6.1
7.CT.1,Cropland nutrient budget,component,target 7,Pollution,Francis Banville,,,indirectly connected,indirectly connected,directly connected,directly connected,not usable,none,not usable,none,not usable,none,usable after adaptation,action 4.1,usable after adaptation,action 5.1,usable after adaptation,action 6.1
7.CT.2,Proportion of domestic and industrial wastewater flows safely treated,component,target 7,Pollution,Elodie Eiffener,,Indicator = positive for H. Indicator of water quality and through that influence on H,indirectly connected,indirectly connected,indirectly connected,directly connected,usable after adaptation,action 1.2,directly usable,action 2.2,usable after adaptation,action 3.2,not usable,none,usable after adaptation,action 5.1,usable after adaptation,action 6.1
7.CT.3,Plastic debris density,component,target 7,Pollution,Elodie Eiffener,,"Indicator = negative for H. Indicator of plastic pollution and plastic influences H. Examples: entangelement in macroplastics, hormone disruptive effects of microplastics",indirectly connected,indirectly connected,indirectly connected,indirectly connected,usable after adaptation,action 1.2,not usable,none,not usable,none,not usable,none,not usable,none,directly usable,action 6.1
7.CT.4,Red List Index (impact of pollution),component,target 7,Pollution,Andrea Paz Velez,,"It measures status of animals (birda, mammals, amphibians) driven by pollution so good measure for environmental health . As for actions in 6. I think it would help with more than 1 action , 1,2 and 3 and mostly 2,3",potentially connected,not connected,not connected,directly connected,not usable,none,not usable,none,not usable,none,not usable,none,not usable,none,directly usable,action 6.3
7.CY.1,Trends in Loss of Reactive Nitrogen to the Environment,complementary,target 7,Pollution,Francis Banville,,,indirectly connected,indirectly connected,directly connected,directly connected,not usable,none,not usable,none,not usable,none,usable after adaptation,action 4.1,usable after adaptation,action 5.1,usable after adaptation,action 6.1
7.CY.2,Trends in Nitrogen Deposition,complementary,target 7,Pollution,Francis Banville,,,indirectly connected,indirectly connected,directly connected,directly connected,not usable,none,not usable,none,not usable,none,usable after adaptation,action 4.1,usable after adaptation,action 5.1,usable after adaptation,action 6.1
7.CY.3,"Proportion of municipal solid waste collected and managed in controlled facilities out of total municipal waste generated, by cities",complementary,target 7,Pollution,Elodie Eiffener,,Indicator = positive for H. Indicator of pollution and through that influence on H. ,indirectly connected,indirectly connected,indirectly connected,indirectly connected,usable after adaptation,action 1.2,usable after adaptation,action 2.1,usable after adaptation,action 3.1,not usable,none,not usable,none,directly usable,action 6.1
7.CY.4,Hazardous waste generation per capita,complementary,target 7,Pollution,Elodie Eiffener,,"Indicator = negative for H. Mainly indirect as no indication of how much of this waste ends up in the environment. However, the less wate generation the better for H in general (less likelihood of it ending up in env)",potentially connected,potentially connected,potentially connected,potentially connected,usable after adaptation,action 1.2,not usable,none,not usable,none,not usable,none,not usable,none,directly usable,action 6.1
7.CY.5,"Trends in the amount of litter, including microplastics, in the water column and on the seafloor",complementary,target 7,Pollution,Elodie Eiffener,,Indicator = negative for H. Indicator of pollution and through that influence on H. ,indirectly connected,indirectly connected,indirectly connected,indirectly connected,usable after adaptation,action 1.1,not usable,none,not usable,none,not usable,none,not usable,none,directly usable,action 6.1
7.CY.6,Pesticide use per area of cropland,complementary,target 7,Pollution,Elodie Eiffener,,Indicator = negative for H. Indicator of concentration/toxicity and toxic element influences H. ,indirectly connected,indirectly connected,indirectly connected,directly connected,usable after adaptation,action 1.1,not usable,none,not usable,none,usable after adaptation,action 4.1,not usable,none,directly usable,action 6.1
8.b,Number of countries with policies to minimize the impact of climate change and ocean acidification on biodiversity and to minimize negative and foster positive impacts of climate action on biodiversity,binary,target 8,Climate change,Gabriel Munoz Acevedo,,Can indicate global engagement and greter likelihood to adopt OneHealth frameworks when developing health policy,potentially connected,directly connected,directly connected,indirectly connected,directly usable,action 1.3,usable after adaptation,action 2.3,directly usable,action 3.2,not usable,none,not usable,none,directly usable,action 6.3
